{
  "eventId": "0199b3a9-1a2b-7c3d-8e4f-5a6b7c8d9f12",
  "eventType": "PaymentSucceeded",
  "eventVersion": 1,
  "occurredAt": "2026-10-05T08:52:43Z",
  "correlationId": "0199b3a9-1a2b-7c3d-8e4f-5a6b7c8d9eff",
  "producer": "payment-service",
  "aggregateId": "0199b3a9-1a2b-7c3d-8e4f-5a6b7c8d9e07",
  "aggregateVersion": 1,
  "payload": {
    "paymentId": "0199b3a9-1a2b-7c3d-8e4f-5a6b7c8d9e07",
    "tripId": "0199b3a9-1a2b-7c3d-8e4f-5a6b7c8d9e01",
    "customerId": "0199b3a9-1a2b-7c3d-8e4f-5a6b7c8d9e02",
    "driverId": "0199b3a8-5c2e-7a41-9b6d-2f7e8c1d4a12",
    "purpose": "TRIP_FARE",
    "amount": 27000,
    "currency": "VND",
    "provider": "SANDBOX",
    "providerRef": "sbx_8f3c2a1b",
    "attemptNo": 1,
    "succeededAt": "2026-10-05T08:52:43Z"
  }
}
