{
  "eventId": "0199b3a9-1a2b-7c3d-8e4f-5a6b7c8d9f10",
  "eventType": "FareFinalized",
  "eventVersion": 1,
  "occurredAt": "2026-10-05T08:52:41Z",
  "correlationId": "0199b3a9-1a2b-7c3d-8e4f-5a6b7c8d9eff",
  "producer": "pricing-service",
  "aggregateId": "0199b3a9-1a2b-7c3d-8e4f-5a6b7c8d9e01",
  "aggregateVersion": 0,
  "payload": {
    "fareId": "0199b3a9-1a2b-7c3d-8e4f-5a6b7c8d9e05",
    "tripId": "0199b3a9-1a2b-7c3d-8e4f-5a6b7c8d9e01",
    "customerId": "0199b3a9-1a2b-7c3d-8e4f-5a6b7c8d9e02",
    "driverId": "0199b3a8-5c2e-7a41-9b6d-2f7e8c1d4a12",
    "quoteId": "0199b3a9-1a2b-7c3d-8e4f-5a6b7c8d9e04",
    "method": "UPFRONT",
    "breakdown": {
      "baseFare": 12000,
      "distanceFare": 11885,
      "timeFare": 2637,
      "minimumFareAdjustment": 0,
      "surgeAmount": 0,
      "roundingAdjustment": 478
    },
    "total": 27000,
    "currency": "VND",
    "surgeMultiplier": 1.0,
    "pricingRuleVersion": 1,
    "completedAt": "2026-10-05T08:52:40Z",
    "finalizedAt": "2026-10-05T08:52:41Z"
  }
}
