{
  "eventId": "0199b3a9-1a2b-7c3d-8e4f-5a6b7c8d9f06",
  "eventType": "TripCancelled",
  "eventVersion": 1,
  "occurredAt": "2026-10-05T08:31:00Z",
  "correlationId": "0199b3a9-1a2b-7c3d-8e4f-5a6b7c8d9eff",
  "producer": "trip-service",
  "aggregateId": "0199b3a9-1a2b-7c3d-8e4f-5a6b7c8d9e01",
  "aggregateVersion": 2,
  "payload": {
    "tripId": "0199b3a9-1a2b-7c3d-8e4f-5a6b7c8d9e01",
    "customerId": "0199b3a9-1a2b-7c3d-8e4f-5a6b7c8d9e02",
    "driverId": "0199b3a8-5c2e-7a41-9b6d-2f7e8c1d4a12",
    "oldStatus": "ACCEPTED",
    "actorType": "CUSTOMER",
    "actorId": "0199b3a9-1a2b-7c3d-8e4f-5a6b7c8d9e02",
    "reason": "CHANGED_MIND",
    "cancelledAt": "2026-10-05T08:32:00Z",
    "serviceType": "RIDE",
    "acceptedAt": "2026-10-05T08:31:05Z",
    "quoteId": "0199b3a9-1a2b-7c3d-8e4f-5a6b7c8d9e04"
  }
}
