{
  "eventId": "0199b3a9-1a2b-7c3d-8e4f-5a6b7c8d9f05",
  "eventType": "TripCompleted",
  "eventVersion": 1,
  "occurredAt": "2026-10-05T08:31:00Z",
  "correlationId": "0199b3a9-1a2b-7c3d-8e4f-5a6b7c8d9eff",
  "producer": "trip-service",
  "aggregateId": "0199b3a9-1a2b-7c3d-8e4f-5a6b7c8d9e01",
  "aggregateVersion": 5,
  "payload": {
    "tripId": "0199b3a9-1a2b-7c3d-8e4f-5a6b7c8d9e01",
    "customerId": "0199b3a9-1a2b-7c3d-8e4f-5a6b7c8d9e02",
    "driverId": "0199b3a8-5c2e-7a41-9b6d-2f7e8c1d4a12",
    "serviceType": "RIDE",
    "pickup": { "latitude": 10.7725, "longitude": 106.698, "address": "Chợ Bến Thành, Quận 1, TP.HCM" },
    "dropoff": { "latitude": 10.7626, "longitude": 106.6822, "address": "Trường ĐH Khoa học Tự nhiên, Quận 5, TP.HCM" },
    "acceptedAt": "2026-10-05T08:31:05Z",
    "completedAt": "2026-10-05T08:52:40Z"
  }
}
